{"apiRoutes":[],"connections":[],"contextHash":"4fc4ffbc553924ebe4a0a4b96c4770475e1dbadb18e5f9495992411e7d9ab8b3","coverage":{"completeForProfile":true,"limitations":[]},"dependencies":[{"evidenceIds":["e-b05c255b1f307661968b"],"reason":"Static observation: dependency.volume","scope":"container","status":"detected","value":{"component":".","kind":"volume","mountPath":"/etc/nginx/nginx.conf","name":"./config/nginx.conf","type":"bind"}},{"evidenceIds":["e-96f8b2171c11305059c0"],"reason":"Static observation: dependency.volume; condition: when Compose file ops/compose.tunnel.yaml is selected","scope":"container","status":"detected","value":{"component":".","kind":"volume","mountPath":"/run/secrets/tunnel-token","name":"./secrets/cloudflared-token","type":"bind"}},{"evidenceIds":["e-b05c255b1f307661968b"],"reason":"Static observation: dependency.volume","scope":"container","status":"detected","value":{"component":".","kind":"volume","mountPath":"/srv/portfolio","name":"./site","type":"bind"}}],"environmentKeys":[],"questions":[],"schemaVersion":"1","services":[{"buildCommand":{"evidenceIds":["e-79e79892a7f877fa331c"],"reason":"Static observation: build.command","scope":"source","status":"detected","value":"vite build"},"componentRoots":["."],"healthchecks":[{"evidenceIds":["e-b05c255b1f307661968b"],"reason":"Static observation: healthcheck.path","scope":"container","status":"detected","value":"/healthz"}],"outputDirectory":{"evidenceIds":["e-79e79892a7f877fa331c"],"reason":"Static observation: output.directory","scope":"production","status":"detected","value":"dist"},"ports":[{"evidenceIds":["e-93000c53b65c5d250799"],"reason":"Static observation: runtime.port","scope":"container","status":"detected","value":8080},{"evidenceIds":["e-79e79892a7f877fa331c"],"reason":"Static observation: runtime.port","scope":"development","status":"detected","value":4387},{"evidenceIds":["e-93000c53b65c5d250799"],"reason":"Static observation: runtime.port","scope":"host_mapping","status":"detected","value":4387}],"role":{"evidenceIds":["e-79e79892a7f877fa331c","e-b05c255b1f307661968b"],"reason":"Observed in the provided source","scope":"source","status":"detected","value":"static"},"root":{"evidenceIds":["e-79e79892a7f877fa331c","e-b05c255b1f307661968b"],"reason":"Observed in the provided source","scope":"source","status":"detected","value":"."},"runtime":{"evidenceIds":["e-576ead495aab5668f3b2"],"reason":"Static observation: runtime.name","scope":"container","status":"detected","value":"nginx"},"serviceId":"svc-3e0606d62bc74dc8","startCommand":{"evidenceIds":["e-b05c255b1f307661968b"],"reason":"Static observation: start.command","scope":"container","status":"detected","value":"nginx -g 'daemon off;'"},"workingDirectory":{"evidenceIds":[],"reason":"No static observation for docker.workdir","scope":"source","status":"unknown","value":null}}],"sourceSnapshotId":"dcab384d9e1a6cfe70ee38b024a06b0bce34cee63a645572e01f89b70c1fddca","status":"complete"}
